{
	"$schema": "https://schema.thingslibrary.io/1.1/item.json",
	
	"types": {
		"node": {
			"name": "Test Node"
		}
	},

	"key": "root_node",
	"name": "Root",
	"type": "node",
	"items": {
		"1_1": {
			"name": "1/1",
			"type": "node",
			"items": {
				"1_1_1": {
					"name": "1/1/1",
					"type": "node",
					"items": {
						"1_1_1_1": {
							"name": "1/1/1/1",
							"type": "node",
							"items": {
								"1_1_1_1_1": {
									"name": "1/1/1/1/1",
									"type": "node"
								}
							}
						}
					}
				}
			}
		},
		"1_2": {
			"name": "1/2",
			"type": "node",
			"items": {
				"1_2_1": {
					"name": "1/2/1",
					"type": "node",
					"items": {
						"1_2_1_1": {
							"name": "1/2/1/1",
							"type": "node",
							"items": {
								"1_2_1_1_1": {
									"name": "1/2/1/1/1",
									"type": "node"
								}
							}
						},
						"1_2_2": {
							"name": "1/2/2",
							"type": "node",
							"items": {
								"1_2_2_1": {
									"name": "1/2/2/1",
									"type": "node"
								}
							}
						},
						"1_2_3": {
							"name": "1/2/3",
							"type": "node",
							"items": {
								"1_2_3_1": {
									"name": "1/2/3/1",
									"type": "node"
								}
							}
						}
					}
				}
			}
		}
	}
}